{
  "content_hash": "a1b2c3d4e5f60718",
  "concern_slug": "architecture",
  "title": "AuthService bypasses repository abstraction",
  "runtime_scope": "service-internal",
  "runtime_scope_justification": "src/auth/service.py is production runtime code.",
  "failure_mode": "degraded-behavior",
  "failure_mode_justification": "Bypassing the repository skips caching and audit logging.",
  "evidence_quality": "demonstrated",
  "evidence_quality_justification": "Lines 42-58 show a direct DB query.",
  "trace_origin": "component",
  "trace_origin_justification": "Traced within auth module.",
  "effort_to_fix": "small",
  "effort_to_fix_justification": "Inject AuthRepository.",
  "locations": [
    {
      "path": "src/auth/service.py",
      "line": "42-58",
      "role": "primary"
    }
  ],
  "issue": "AuthService reads the database directly.",
  "why_it_matters": "All other services use repositories.",
  "suggested_fix": "Inject AuthRepository.",
  "source_dimensions": [
    "auth"
  ]
}
